{"$schema":"../schemas/workflow-definition.schema.json","workflow_id":"WF-CAP-REQ-CALIBRATION-001","workflow_version":"0.1.0","policy_version":"0.1.0","registry_version":"1.0.0","trigger":{"type":"candidate_calibration","reference":"ADR-0019"},"version_pins":{"contracts":{"universal":"1.0.0","capability":"1.0.0"},"prompts":{"CAP-REQ":"design-0.1.0"},"rubrics":{"CAP-REQ":"0.1.0"},"schemas":{"universal":"universal-agent-artifact.schema.json","capability":"capability-extension.schema.json","role":"cap-req-role.schema.json"},"model":{"provider":"fixture","model_id":"deterministic-reference-agent","version":"0.1.0"},"toolchain":{"version":"0.1.0"}},"nodes":[{"node_id":"cap-req-candidate","agent_uuid":"9a82a407-38f6-4abe-9ef8-49f0fd256e67","designation":"CAP-REQ","layer":"capability","required_inputs":["REQUIREMENTS-SOURCE-MANIFEST","PROD-SEC-ARTIFACT","EVIDENCE-LOCATOR"],"output_schema":"capability-extension.schema.json","role_schema":"cap-req-role.schema.json","partial_input_policy":"prohibited","consumers":["CAP-COORD-CANDIDATE"]}],"edges":[],"human_gates":[{"gate_id":"requirements-artifact-acceptance","after_node":"cap-req-candidate","authority_role":"requirements-acceptance-authority","decision_types":["accept_live_capability_review_artifact"]}]}
